{
  "id": "T4",
  "command": "node flightdeck/testbench/suites/hooks-eventlog/run.mjs",
  "cwd": "/Users/dylangraham/Projects/flightdeck",
  "exit": 0,
  "verdict": "pass",
  "stdout_tail": [
    "pass  records-SessionStart",
    "pass  records-SessionEnd",
    "pass  records-SubagentStart",
    "pass  records-SubagentStop",
    "pass  records-TaskCreated",
    "pass  records-TaskCompleted",
    "pass  records-PostToolUseFailure",
    "pass  records-PermissionDenied",
    "pass  records-PreCompact",
    "pass  records-PostCompact",
    "pass  records-Stop",
    "pass  records-WorktreeRemove",
    "pass  one-line-per-invocation",
    "pass  phase-follows-launch-json",
    "pass  detail-keys-hold-under-noisy-envelope",
    "pass  ignores-PreToolUse",
    "pass  ignores-PostToolUse",
    "pass  ignores-UserPromptSubmit",
    "pass  ignores-Notification",
    "pass  ignores-WorktreeCreate",
    "pass  ignores-Setup",
    "pass  session-start-system-message",
    "pass  session-start-system-message-names-current-phase",
    "pass  flightcrew-launch-none-silences-every-hook",
    "pass  flightcrew-launch-none-fc-needs-launch",
    "pass  event-line-is-single-line-json",
    "covers: B5 B52 I5",
    "26/26 passed"
  ],
  "stderr_tail": [],
  "duration_ms": 11842,
  "ran_at": "2026-09-03T22:06:50.496Z",
  "commit": "49aff47990c6b7df60c2da3f8a57fb20cb366e01",
  "covers": [
    "B5",
    "B52",
    "I5"
  ],
  "phase": "verify"
}
