{
  "id": "T5",
  "command": "node flightdeck/testbench/suites/hooks-guards/run.mjs",
  "cwd": "/Users/dylangraham/Projects/flightdeck",
  "exit": 0,
  "verdict": "pass",
  "stdout_tail": [
    "pass  lock-edit-locked-denied",
    "pass  lock-write-locked-denied",
    "pass  lock-notebook-locked-denied",
    "pass  lock-launch-spec-copy-denied",
    "pass  lock-unlocked-target-silent",
    "pass  lock-every-phase-except-targets",
    "pass  lock-phase-targets-silent",
    "pass  lock-relative-path-absolutised-against-cwd",
    "pass  lock-worktree-target-relative-to-worktree-root",
    "pass  boundary-outside-denied",
    "pass  boundary-inside-silent",
    "pass  boundary-enforced-phases",
    "pass  boundary-phase-targets",
    "pass  boundary-not-enforced-silent",
    "pass  boundary-worktree-target-relative-to-worktree-root",
    "pass  two-active-launches-ask",
    "pass  two-active-launches-env-selects-one",
    "pass  unreadable-launch-json-ask",
    "pass  trigger-fired-guards-deny-everything",
    "pass  trigger-cleared-by-newer-gate-event",
    "pass  trigger-cleared-by-newer-escalation-or-end",
    "pass  trigger-older-than-gate-does-not-fire",
    "pass  trigger-fired-fc-worker-render-exits-2",
    "pass  trigger-fired-fc-worker-merge-exits-2",
    "pass  trigger-fired-fc-launch-phase-exits-2",
    "pass  trigger-fired-fc-launch-phase-ended-allowed",
    "covers: B6 B7 B42 B53 I7",
    "26/26 passed"
  ],
  "stderr_tail": [],
  "duration_ms": 16089,
  "ran_at": "2026-09-03T22:07:06.585Z",
  "commit": "49aff47990c6b7df60c2da3f8a57fb20cb366e01",
  "covers": [
    "B6",
    "B7",
    "B42",
    "B53",
    "I7"
  ],
  "phase": "verify"
}
