{
  "id": "T25",
  "command": "node flightdeck/testbench/suites/hook-timing/run.mjs",
  "cwd": "/Users/dylangraham/Projects/flightdeck",
  "exit": 0,
  "verdict": "pass",
  "stdout_tail": [
    "pass  event-log-under-2000ms",
    "pass  lock-guard-under-2000ms",
    "pass  boundary-guard-under-2000ms",
    "pass  structural-check-under-2000ms",
    "pass  stop-gate-under-2000ms",
    "pass  session-end-under-2000ms",
    "pass  settings-fragment-stop-timeout-600",
    "covers: C4",
    "7/7 passed"
  ],
  "stderr_tail": [],
  "duration_ms": 6045,
  "ran_at": "2026-09-03T22:50:05.183Z",
  "commit": "9131265aa5b969adf634103f186b73d185a3f3f5",
  "covers": [
    "C4"
  ],
  "phase": "verify"
}
