{
  "id": "T7",
  "command": "node flightdeck/testbench/suites/hooks-stopgate/run.mjs",
  "cwd": "/Users/dylangraham/Projects/flightdeck",
  "exit": 0,
  "verdict": "pass",
  "stdout_tail": [
    "pass  verify-red-blocks-with-id-code-and-output",
    "pass  verify-red-counts-consecutive-blocks",
    "pass  verify-red-last-twenty-lines",
    "pass  verify-green-appends-check-run",
    "pass  verify-green-resets-count",
    "pass  verify-phase-or-gate-event-resets-count",
    "pass  verify-runs-only-the-acceptance-check",
    "pass  stall-at-stop-blocks-ceiling",
    "pass  stall-at-cap-eight",
    "pass  other-phases-no-op",
    "pass  contracts-green-appends-check-run",
    "pass  contracts-runs-only-w0-checks",
    "pass  contracts-red-w0-check-blocks",
    "pass  contracts-error-verdict-blocks",
    "pass  contracts-expected-failure-does-not-block",
    "pass  contracts-boundary-red-blocks",
    "pass  contracts-no-contracts-falls-back-to-t1",
    "pass  escalation-file-releases-stop-gate",
    "pass  escalation-file-releases-contracts-gate",
    "pass  fc-escalate-writes-file-and-event",
    "pass  fc-gate-removes-escalation",
    "pass  fc-phase-removes-escalation",
    "pass  fc-end-removes-escalation",
    "covers: B9 B10 B11 B40 B41",
    "23/23 passed"
  ],
  "stderr_tail": [],
  "duration_ms": 27997,
  "ran_at": "2026-09-04T02:45:03.178Z",
  "commit": "c28578e402a927a3049db463859d3efd7b49fe13",
  "covers": [
    "B9",
    "B10",
    "B11",
    "B40",
    "B41"
  ],
  "phase": "report"
}
