{
  "id": "T8",
  "command": "node flightdeck/testbench/suites/bin-check/run.mjs",
  "cwd": "/Users/dylangraham/Projects/flightdeck",
  "exit": 0,
  "verdict": "pass",
  "stdout_tail": [
    "pass  check-all-runs-every-live-check-and-exits-0",
    "pass  check-all-exits-2-on-a-failing-verdict",
    "pass  check-all-records-skipped-for-quarantined-ids-without-affecting-exit",
    "pass  check-subset-rebuilds-summary-from-the-evidence-files-present",
    "pass  evidence-file-validates-and-carries-command-exit-commit-phase-covers",
    "pass  evidence-tails-are-the-last-forty-lines-of-each-stream",
    "pass  check-runs-with-flightcrew-launch-in-env-and-cwd-launch-root-or-cwd-flag",
    "pass  checks-run-serially-in-map-order",
    "pass  missing-binary-is-verdict-error-others-still-run-exit-2",
    "pass  pin-mismatch-exits-1-and-runs-nothing",
    "pass  no-tests-map-pinned-exits-1",
    "pass  unknown-check-id-exits-1-naming-it-and-runs-nothing",
    "pass  baseline-writes-observed-commit-and-date-into-the-draft-map-and-no-evidence",
    "pass  baseline-records-fail-and-error-words-and-exits-2-when-a-command-cannot-spawn",
    "pass  verify-runs-check-boundary-locked-budget-in-order-and-exits-0-when-clean",
    "pass  verify-exits-2-when-boundary-is-red-and-still-writes-every-file",
    "pass  verify-exits-2-when-a-check-fails",
    "covers: B12 B13 B36 B46 E2 E8 E11 E17 I6",
    "17/17 passed"
  ],
  "stderr_tail": [],
  "duration_ms": 21544,
  "ran_at": "2026-09-04T02:45:24.722Z",
  "commit": "c28578e402a927a3049db463859d3efd7b49fe13",
  "covers": [
    "B12",
    "B13",
    "B36",
    "B46",
    "I6",
    "E2",
    "E8",
    "E11",
    "E17"
  ],
  "phase": "report"
}
