{
  "id": "T20",
  "command": "node flightdeck/testbench/suites/bin-distribute/run.mjs",
  "cwd": "/Users/dylangraham/Projects/flightdeck",
  "exit": 0,
  "verdict": "pass",
  "stdout_tail": [
    "pass  dry-run-lists-and-writes-nothing",
    "pass  apply-copies-crew-and-workflows-only",
    "pass  apply-prints-fragment-gitignore-and-constitution",
    "pass  apply-twice-with-identical-content-succeeds",
    "pass  conflict-lists-paths-copies-nothing-exits-2",
    "pass  force-overwrites-conflicts",
    "covers: B29 E10",
    "6/6 passed"
  ],
  "stderr_tail": [],
  "duration_ms": 869,
  "ran_at": "2026-09-03T22:08:52.586Z",
  "commit": "49aff47990c6b7df60c2da3f8a57fb20cb366e01",
  "covers": [
    "B29",
    "E10"
  ],
  "phase": "verify"
}
