{
  "id": "T3",
  "command": "node --test tests/export/contract.test.mjs",
  "cwd": "/home/writer/export-html",
  "exit": 0,
  "verdict": "pass",
  "stdout_tail": [
    "TAP version 13",
    "# Subtest: I1 exportProject is a function of (project, options) returning {html: string, warnings: array}",
    "ok 1 - I1 exportProject is a function of (project, options) returning {html: string, warnings: array}",
    "  ---",
    "  duration_ms: 0.852083",
    "  type: 'test'",
    "  ...",
    "# Subtest: I2 the reference project has the declared shape and every warning carries code, message and page",
    "ok 2 - I2 the reference project has the declared shape and every warning carries code, message and page",
    "  ---",
    "  duration_ms: 0.126833",
    "  type: 'test'",
    "  ...",
    "1..2",
    "# tests 2",
    "# suites 0",
    "# pass 2",
    "# fail 0",
    "# cancelled 0",
    "# skipped 0",
    "# todo 0",
    "# duration_ms 50.499291"
  ],
  "stderr_tail": [],
  "duration_ms": 118,
  "ran_at": "2026-08-30T10:44:53Z",
  "commit": "18293a4",
  "covers": [
    "I1",
    "I2"
  ],
  "phase": "verify"
}
