{
  "id": "T12",
  "command": "node flightdeck/testbench/suites/bin-runlog/run.mjs",
  "cwd": "/Users/dylangraham/Projects/flightdeck",
  "exit": 0,
  "verdict": "pass",
  "stdout_tail": [
    "pass  stub-creates-run-log-with-accepted-entry",
    "pass  stub-inserts-after-first-heading-newest-first",
    "pass  stub-abandoned-carries-diagnosis-fields",
    "pass  stub-partial-lists-landed-and-abandoned-units",
    "pass  end-accepted-inserts-accepted-entry",
    "covers: B20",
    "5/5 passed"
  ],
  "stderr_tail": [],
  "duration_ms": 5547,
  "ran_at": "2026-09-04T02:45:52.353Z",
  "commit": "c28578e402a927a3049db463859d3efd7b49fe13",
  "covers": [
    "B20"
  ],
  "phase": "report"
}
