{
  "id": "T15",
  "command": "node flightdeck/testbench/suites/validate-tests-map/run.mjs",
  "cwd": "/Users/dylangraham/Projects/flightdeck",
  "exit": 0,
  "verdict": "pass",
  "stdout_tail": [
    "pass  positive-sample-map",
    "pass  tm-invariant-1-id-without-prefix",
    "pass  tm-invariant-2-duplicate-id",
    "pass  tm-invariant-3-id-hole",
    "pass  tm-invariant-4-v1-check-not-ok",
    "pass  tm-invariant-4-v1-carries-retired",
    "pass  tm-invariant-5-non-ok-without-note",
    "pass  tm-invariant-6-frozen-without-commit",
    "pass  tm-invariant-6-draft-with-commit",
    "pass  tm-invariant-7-retired-at-above-version",
    "pass  tm-invariant-7-retired-at-below-two",
    "pass  tm-invariant-8-retired-covers-not-remapped",
    "pass  tm-invariant-8-retired-covers-remapped-is-clean",
    "pass  tm-invariant-9-lineage-missing-earlier-version",
    "pass  tm-invariant-9-lineage-not-newest-first",
    "pass  tm-invariant-10-acceptance-not-T1",
    "pass  tm-invariant-11-observed-word-differs",
    "pass  tm-invariant-12-spec-pin-not-frozen",
    "pass  tm-invariant-12-waived-under-allow-draft",
    "pass  tm-invariant-13-empty-allowed-paths",
    "pass  tm-invariant-13-empty-locked-paths",
    "pass  validator-script-accepts-the-pinned-map",
    "pass  validator-script-names-tm-invariant-1",
    "pass  coverage-rule-live-node-uncovered",
    "pass  coverage-rule-satisfied-by-unverified",
    "covers: B23",
    "25/25 passed"
  ],
  "stderr_tail": [],
  "duration_ms": 12042,
  "ran_at": "2026-09-03T22:08:22.666Z",
  "commit": "49aff47990c6b7df60c2da3f8a57fb20cb366e01",
  "covers": [
    "B23"
  ],
  "phase": "verify"
}
