{
  "id": "T26",
  "command": "node flightdeck/testbench/suites/schemas/run.mjs",
  "cwd": "/Users/dylangraham/Projects/flightdeck",
  "exit": 0,
  "verdict": "pass",
  "stdout_tail": [
    "pass  event-schema-rejects-source-outside-enum",
    "pass  event-schema-requires-ts",
    "pass  event-schema-rejects-string-detail",
    "pass  check-result-sample-T1-validates",
    "pass  check-result-sample-T2-validates",
    "pass  check-result-sample-T3-validates",
    "pass  check-result-sample-T4-validates",
    "pass  check-result-sample-T5-validates",
    "pass  check-result-schema-rejects-verdict-outside-enum",
    "pass  check-result-schema-rejects-string-exit",
    "pass  check-result-schema-requires-commit",
    "pass  explorer-return-sample-validates",
    "pass  worker-return-sample-U0-validates",
    "pass  worker-return-sample-U1-validates",
    "pass  worker-return-sample-U2-validates",
    "pass  worker-return-sample-U3-validates",
    "pass  verifier-verdict-sample-validates",
    "pass  critic-findings-sample-validates",
    "pass  explorer-return-rejects-confidence-outside-enum",
    "pass  worker-return-rejects-status-outside-enum",
    "pass  worker-return-rejects-halt-kind-outside-enum",
    "pass  verifier-verdict-rejects-string-refuted",
    "pass  critic-findings-rejects-finding-kind-outside-enum",
    "pass  critic-findings-rejects-severity-outside-enum",
    "pass  fc-validate-return-accepts-returns-explore-X1-as-explorer",
    "pass  fc-validate-return-accepts-returns-U0-as-worker",
    "pass  fc-validate-return-accepts-returns-U1-as-worker",
    "pass  fc-validate-return-accepts-returns-U2-as-worker",
    "pass  fc-validate-return-accepts-returns-U3-as-worker",
    "pass  fc-validate-return-accepts-returns-verify-1-as-verifier",
    "pass  fc-validate-return-accepts-review-pass-1-as-critic",
    "pass  fc-validate-return-rejects-by-schema-keyword",
    "pass  fragment-hook-commands-run-in-place",
    "pass  fragment-wires-each-hook-to-its-events",
    "pass  fragment-stop-hook-timeout-600",
    "pass  fragment-worktree-baseref-head",
    "pass  fragment-permissions-allow",
    "pass  fragment-permissions-deny-and-sandbox-example",
    "covers: I2 I3 I4 I5 I6 I8 I14",
    "64/64 passed"
  ],
  "stderr_tail": [],
  "duration_ms": 3958,
  "ran_at": "2026-09-03T22:09:24.376Z",
  "commit": "49aff47990c6b7df60c2da3f8a57fb20cb366e01",
  "covers": [
    "I2",
    "I3",
    "I4",
    "I5",
    "I6",
    "I8",
    "I14"
  ],
  "phase": "verify"
}
