{
  "id": "T29",
  "command": "node flightdeck/testbench/suites/workflows/run.mjs",
  "cwd": "/Users/dylangraham/Projects/flightdeck",
  "exit": 0,
  "verdict": "pass",
  "stdout_tail": [
    "pass  passes-node-module-check",
    "pass  first-statement-is-export-const-meta-with-name-equal-to-filename",
    "pass  no-date-now-new-date-or-math-random",
    "pass  schema-literals-equal-the-schema-files",
    "covers: B39",
    "4/4 passed"
  ],
  "stderr_tail": [],
  "duration_ms": 173,
  "ran_at": "2026-09-04T02:47:49.694Z",
  "commit": "c28578e402a927a3049db463859d3efd7b49fe13",
  "covers": [
    "B39"
  ],
  "phase": "report"
}
