{
  "id": "T14",
  "command": "node flightdeck/testbench/suites/validate-spec/run.mjs",
  "cwd": "/Users/dylangraham/Projects/flightdeck",
  "exit": 0,
  "verdict": "pass",
  "stdout_tail": [
    "pass  golden-v1-clean",
    "pass  golden-v2-clean",
    "pass  schema-missing-required",
    "pass  schema-unknown-key",
    "pass  schema-bad-enum",
    "pass  schema-bad-type",
    "pass  schema-empty-behaviours",
    "pass  schema-bad-commit-pattern",
    "pass  inv1-duplicate-id",
    "pass  inv2-misplaced-id",
    "pass  inv3-frozen-without-commit",
    "pass  inv3-frozen-with-open-question",
    "pass  inv3-for-freeze-rehearsal",
    "pass  inv4-draft-carrying-commit",
    "pass  inv5-retired-id-reused",
    "pass  inv6-not-ascending",
    "pass  inv6-entry-not-lower-than-version",
    "pass  inv6-duplicate-file",
    "pass  inv8-v1-node-not-ok",
    "pass  inv8-v1-carries-retired",
    "pass  inv9-changed-without-note",
    "pass  inv10-filename-version-mismatch",
    "pass  inv10-unrecognised-filename",
    "pass  inv11-retired-at-after-version",
    "pass  inv11-retired-at-below-two",
    "pass  inv12-lineage-hole",
    "pass  warn-edge-states-a-concern",
    "pass  warn-folder-name-mismatch",
    "pass  warn-edge-bare-noun-phrase",
    "pass  warn-edge-condition-colon-outcome-is-clean",
    "pass  inv13-id-hole",
    "covers: B22",
    "31/31 passed"
  ],
  "stderr_tail": [],
  "duration_ms": 1528,
  "ran_at": "2026-09-03T22:08:10.624Z",
  "commit": "49aff47990c6b7df60c2da3f8a57fb20cb366e01",
  "covers": [
    "B22"
  ],
  "phase": "verify"
}
